Product Name,Price
Ambewela Full Cream Fresh Milk Tetra 1L,Rs 500.00
Anchor Full Cream Milk Powder Packet 400g,"Rs 1,100.00"
Ratthi Full Cream Milk Powder Pkt 400g,"Rs 1,100.00"
Kotmale Flavoured Milk Uht Chocolate Tetra 170Ml,Rs 100.00
Kotmale Full Cream Plain Milk Tetra 180Ml,Rs 130.00
Sprite Pet Bottle 400Ml,Rs 200.00
Coca Cola Pet Bottle 400Ml,Rs 200.00
Elephant House Cream Soda Can 250ml,Rs 150.00
Kinley Soda Pet Bottle 400Ml,Rs 100.00
Ambewela Uht Milk Tetra 200ml,Rs 130.00
Aquafina Bottled Drinking Water Pet Bottle 500ml,Rs 70.00
Lakspray Full Cream Milk Powder Pouch 400g,"Rs 1,045.00 / Unit"
Fanta Portello Pet Bottle 400ml,Rs 200.00
Kist Nectar Mixed Fruit Pet Bottle 200Ml,Rs 140.00
Newdale Flav Milk Uht Vanilla Pou 150ml,Rs 90.00 / Unit
Elephant House Orange Crush Can 250ml,Rs 150.00
Anchor Full Cream Uht Milk Tetra 1L,Rs 510.00
Mountain Dew Pet Bottle 400Ml,Rs 180.00
Watawala Tea Kahata Pouch 400g,"Rs 1,140.00"
Kist Sparkling Str Berry Drink Can 250ml,Rs 180.00
Milo Food Drink Chocolate Tetra 180ml,Rs 130.00
Ambewela Non-Fat Milk Uht Tetra 1L,Rs 520.00
Ride Sugar Free Can 250ml,Rs 262.00 / Unit
Fanta Orange Pet Bottle 400ml,Rs 200.00
Fanta Cream Soda Pet Bottle 400ml,Rs 200.00
Ratthi Full Cream Milk Powder Packet 1Kg,"Rs 2,750.00"
Kist Sparkling Gre Apple Drink Can 250ml,Rs 180.00
Maliban Full Cream Milk Powder Pou 400g,"Rs 1,100.00"
Richlife Iced Coffee Tetra 180ml,Rs 119.00 / Unit
Anchor Non-Fat Milk Powder Packet 400g,"Rs 1,200.00"
Kico King Coconut Water Tetra 200ml,Rs 150.00
Highland Flav Milk Uht Choc Pkt 180ml,Rs 100.00
Kist Sparkling Orange Drink Can 250ml,Rs 153.00 / Unit
Alkafresh Alkaline Drinking Water Pet Bottle 500ml,Rs 175.00
Kist Nectar Mango Pet Bottle 200Ml,Rs 140.00
Sustagen Nutritional Supplement Powder Vanilla Tin 400G,"Rs 3,900.00"
Newdale Flavored Milk Uht Vanilla Tetra 180Ml,Rs 130.00
Teaser Iced Tea Sparkling Mocktail Mixed Berries Can 250ml,Rs 290.00
Sun Crush Sparkling Appifizz Green Can 250Ml,Rs 150.00
Sun Crush Sparkling Appifizz Red Can 250Ml,Rs 150.00
Sun Crush Sparkling Grapee Fizz Can 250Ml,Rs 150.00
Newdale Flavored Milk Uht Strawberry Tetra 180Ml,Rs 130.00
Elephant House Drinking Water Pet Bottle 500ml,Rs 70.00
Kotmale Flav Milk Iced Coffee Tet 180ml,Rs 130.00
Newdale Wam Strawberry Tetra 180ml,Rs 100.00
Newdale Wam Apple Tetra 180ml,Rs 100.00
Kist Nectar Lemon & Mint Pet Bottle 200Ml,Rs 140.00
Anchor Full Cream Milk Powder Packet 1kg,"Rs 2,750.00"
Dilmah Iced Tea Mango Tetra 250ml,Rs 230.00
Md Nectar Mango Pet Bottle 200Ml,Rs 140.00
Anlene High Calcium Low Fat Milk Powder Packet 400g,"Rs 1,255.00 / Unit"
Sunquick Nectar Mixed Fruit Tetra 200ml,Rs 140.00
Nescafe Classic Coffee Jar 200g,"Rs 3,060.00 / Unit"
Keells Tea Kahata Pouch 200g,Rs 460.00
Sun Crush Imperial Tonic Can 250ml,Rs 150.00
Elephant House Soda Pet Bottle 1.5L,Rs 250.00
Dayfresh Full Cream Uht Milk Tetra 1L,Rs 470.00
Vita Coco Coconut Water Original Tetra 330ml,Rs 310.00
Sl Sport Isotonic Lime Pet Bottle 500Ml,Rs 350.00
Kotmale Low Fat Fresh Milk Tetra 1L,Rs 520.00
Elephant House Ginger Beer Pet Bottle 500ml,Rs 200.00
Dilmah Tea Bopf Premium Loose Pouch 400g,"Rs 1,430.00"
Lipton Tea Kahata Laojee Pouch 100g,Rs 295.00
Keells Drinking Water Pet 500ml,Rs 70.00
Kotmale Full Cream Uht Milk Tetra 1L,Rs 500.00
Ratthi Full Cream Milk Powder Pouch 200G,Rs 580.00
Red Bull Energy Drink 250Ml,Rs 750.00
Olu Mineral Water Glass Bottle 330ml,Rs 285.00
Daily Flavored Milk Uht Chocolate Milk Tetra 180Ml,Rs 130.00
Kotmale Flav Milk Vanilla Tetra 180ml,Rs 130.00
Dilmah Iced Tea Gre Tea & Lyc Tet 250ml,Rs 230.00
Newdale Flav Milk Uht Choco Pou 150ml,Rs 90.00 / Unit
Nescafe Ice Cold Coffee 180ml,Rs 150.00
Sunquick Nectar Guava And Strawberry Tetra 200ml,Rs 140.00
Sunquick Nectar Mix Ber Fruit Tet 200ml,Rs 140.00
Highland Flav Milk Uht Vanilla Pkt 180ml,Rs 100.00
Richlife Flavoured Milk Mango Tetra 180Ml,Rs 119.00 / Unit
Sting Caffeinated Drink Pet Bottle 250Ml,Rs 120.00
Keells Drinking Water Pet 5L,Rs 350.00
Watawala Tea Kahata Pouch 200g,Rs 580.00
Kotmale Flavoured Milk Uht Vanilla Tetra 170Ml,Rs 100.00
Dilmah Tea Bopf Premium Loose-Leaf Pouch 100G,Rs 365.00
Elephant House Ginger Beer Pet Bottle 1L,Rs 300.00
Lion Ginger Beer Pet Bottle 400ml,Rs 200.00
Elephant House Cream Soda Pet Bottle 1L,Rs 300.00
Scan Drinking Water Pet Bottle 500Ml,Rs 70.00
Zesta Tea Bopf Pouch 390g,Rs 975.00 / Unit
Kist Juice Grape 1L,"Rs 1,500.00"
Motha Faluda Mix Packet 200G,Rs 256.00 / Unit
Sunquick Nectar Orange Tetra 200ml,Rs 140.00
Diabetasol Nutrient Powder Vanilla Packet 180G,"Rs 1,920.00"
Lipton Tea Green Classic Bag Box 1.5G*20S,Rs 289.00 / Unit
Island Caramel Coffee Pouch 100g,Rs 450.00
Kist Nectar Wood Apple Pet Bottle 200Ml,Rs 140.00
Kotmale Non-Fat Fresh Milk Tetra 1L,Rs 520.00
Elephant House Tonic Pet Bottle 500ml,Rs 200.00
St Clairs Inguru Kottamalli 20S 40G,Rs 380.00
Ambewela Flavoured Milk Uht Chocolate Tetra 1L,Rs 550.00
Vita Coco Coconut Water Original Tetra 1L,Rs 760.00
Sun Crush Sparkling Orangena Can 250Ml,Rs 150.00
Sun Crush Sparkling Ginger Can 250Ml,Rs 150.00
Olu Leopard Edition Mineral Water Glass Bottle 625ml,Rs 440.00
Yeti Isotonic Yeti Blast Pet Bottle 500ml,Rs 350.00
Nestle Coffeemate Pouch 450g,"Rs 1,750.00"
Kotmale Flavoured Milk Uht Strawberry Tetra 170Ml,Rs 85.00 / Unit
Ambewela Non-Fat Milk Uht Tetra 200ml,Rs 130.00
Dilmah Tea Flavoured Mint Bag Box 1.5S*20S,Rs 450.00
Kist Nectar Mango Passion Pet Bottle 1L,Rs 550.00
Elephant House Tonic Can 250ml,Rs 150.00
Dilmah Iced Tea Peach Tetra 250ml,Rs 230.00
Farm Lanka Goat Milk Chocolate Glass Bottle 190ml,Rs 260.00
Kist Juice Green Apple Tetra 200ml,Rs 270.00
Eh Necto Can 250Ml 4S,Rs 580.00
Eh Vibe Kiwi Burst Can 250ml,Rs 150.00
Nescafe Classic Coffee Jar 100g,"Rs 2,000.00"
Fontana Juice Apple Tetra 1L,"Rs 1,490.00"
Fontana Juice Orange Tetra 1L,"Rs 1,634.00 / Unit"
Highland Full Cream Uht Milk Pkt 900ml,Rs 380.00
Milo Malted Food Drink Chocolate Tin 400G,"Rs 1,250.00"
Pepsi Pet Bottle 400Ml,Rs 180.00
Sprite Zero Pet Bottle 400ml,Rs 200.00
Lakspray Full Cream Milk Powder Pouch 1kg,"Rs 2,612.00 / Unit"
Bogawantalawa Tea Kahata Extra Strong 200G,Rs 569.00 / Unit
Sl Sport Isotonic Pomegranate Pet Bottle 500Ml,Rs 350.00
Maliban Melko Milk Powder Packet 400G,Rs 990.00
Sprite Pet Bottle 2L,Rs 480.00
Spinner Caffeinated Drink Can 250ml,Rs 350.00
Arocafe Coffee Jar 100g,"Rs 1,895.00"
Md Nectar Mango Pet Bottle 500Ml,Rs 300.00
Richlife Full Cream Fresh Milk Uht Tetra 1L,Rs 500.00
Zesta Tea Herbal Wellness Infusion Detox Bag Box 2G*20S,"Rs 1,060.00"
Puredale Kirithe Milk Powder 3 In 1 Packet 400G,Rs 880.00
Sozo Juice Pani Dodang And Salt Glass Bottle 1L,"Rs 1,691.00 / Unit"
Coca Cola Zero Pet Bottle 1.05L,Rs 300.00
Dilmah Iced Tea Mix Berry Tra 250ml,Rs 230.00
Milo Food Drink Chocolate Tetra 180Ml 6 Set,Rs 755.00
Eh Lemonade Pet 500ml,Rs 150.00
Bogawan. Tea Kahata Class. Loose Pou 200G,Rs 637.00 / Unit
Farm Lanka Goat Milk Glass Bottle 190ml,Rs 260.00
Nestomalt Malted Food Drink Pouch 400G,Rs 770.00
Smak Nectar Aloe Vera Pet Bottle 1L,Rs 570.00
Richlife Non Fat Milk Tetra 1L,Rs 550.00
Soyfresh Soya Milk Tetra 1L,"Rs 1,710.00"
Md Nectar Orange Pet Bottle 200Ml,Rs 140.00
Zesta Tea Green Bag Box 1.5G*25S,Rs 390.00
Sozo Juice Pani Dodang And Sea Salt Glass Bottle 200Ml,Rs 501.00 / Unit
Yeti Vitamin Drink Orange Pet Bottle 500ml,Rs 350.00
Smak Nectar Aloe Vera Pet Bottle 500Ml,Rs 320.00
Sustagen Nutritional Supplement Powder Chocolate Tin 400G,"Rs 3,900.00"
Elephant House Ginger Beer Sugar-Free Pet Bottle 500ml,Rs 150.00
Smak Nectar Wood Apple Tetra 200ml,Rs 130.00
Colman's Flavoured Drink Orange Pouch 120G,Rs 260.00
Sozo Juice Lime Crush Glass Bottle 350ml,Rs 578.00 / Unit
Dilmah Tea Premium Bag Box 2G*100S,"Rs 1,530.00"
Kotmale Flav Milk Uht Choc Tet 180Ml 6S,Rs 650.00
Yeti Bcaa Vitamin Drink Pet Bottle 500ml,Rs 400.00
Yeti Burn Vitamin Drink Pet Bottle 500ml,Rs 400.00
Elephant House Soda Pet Bottle 1L,Rs 180.00
Keells Drinking Chocolate Powder Tin 200G,Rs 853.00 / Unit
Scan Drinking Water Pet Bottle 5L,Rs 350.00
Farm Lanka Goat Milk Vanilla Glass Bottle 190ml,Rs 260.00
Dilmah Tea Kahata Strong 200g,Rs 544.00 / Unit
Kist Juice Green Apple Tetra 1L,"Rs 1,300.00"
Pure Harvest Organic Almond Original Tetra 1L,"Rs 2,650.00"
Cristal Bottled Drinking Water Pet Bottle 5L,Rs 350.00
Md Nectar Divul Kiri Pet Bottle 200Ml,Rs 140.00
Smak Nectar Mango Tetra 200ml,Rs 130.00
Nestomalt Malted Food Drink Tin 400g,"Rs 1,190.00"
Scan Drinking Water Pet Bottle 1.5L,Rs 130.00
Pelwatte Full Cream Milk Powder Pouch 400G,"Rs 1,050.00"
Keells Drinking Water Pet 1.5L,Rs 130.00
Zesta Tea Bopf Tea Bag Pouch 1.8G*50S,Rs 675.00
Pelwatte Non-Fat Milk Powder Packet 400G,"Rs 1,180.00"
Ensure Milk Powder Vanilla Tin 400g,"Rs 4,900.00 / Unit"
Fanta Portello Pet Bottle 1.05L,Rs 300.00
Coca Cola Zero Pet Bottle 400ml,Rs 200.00
Colman'sâ Flavoured Drink Orange Box 400G,Rs 695.00
Fadna Tea Green Gotukola Bag 2G*18S,Rs 480.00
Sunquick Squash Concentrate Pink Guava And Strawberry Jumbo Glass Bottle 700ml,"Rs 1,540.00"
Smak Nectar Mixed Fruit Pet Bottle 1L,Rs 570.00
Fanta Orange Pet Bottle 1.5L,Rs 400.00
Aquafina Bottled Drinking Water Pet Bottle 1.5L,Rs 130.00
Kotmale Full Cream Milk Chocolate Tetra 1L,Rs 550.00
Smak Nectar Mixed Fruit Tetra 200ml,Rs 130.00
My Juicee Nectar Mango Tetra 180ml,Rs 120.00
Elephant House Ginger Beer Can 250ml,Rs 150.00
Khao Shong Agglomerated Coffee Pouch 45G,Rs 915.00
Vitagen Nutritional Supplement Powder Vanilla Tin 400g,"Rs 3,000.00"
Maliban Full Cream Uht Milk Tetra 1L,Rs 500.00
Ride Red Berry Can 250ml,Rs 350.00
Kotmale Iced Coffee Tetra 1L,Rs 600.00
Puredale Kirithe Milk Powder 3 In 1 Packet 1Kg,"Rs 2,200.00"
Zesta Tea Herbal Wellness Infusion Fat Burn Bag Box 2G*20S,"Rs 1,060.00"
Ride Classic Can 250ml,Rs 350.00
Coca Cola Pet Bottle 1.05L,Rs 300.00
Zara Milk Tea Mix Cardomom 3 In 1 Packet 400g,"Rs 1,070.00"
Kist Nectar Mango Pet Bottle 500Ml,Rs 255.00 / Unit
Horlicks Malted Food Drink Packet 350g,"Rs 1,100.00"
Elephant House Drinking Water Pet Bottle 1.5L,Rs 130.00
May Non-Alcoholic Sparkling White Wine Glass Bottle 750Ml,"Rs 3,130.00"
Dilmah Tea English Afternoon Tin 125g,"Rs 1,600.00"
Elephant House Necto Pet Bottle 1.5L,Rs 400.00
Harischandra Plain Coffee Pouch 100g,Rs 400.00
Highland Full Cream Milk Powder Pkt 400g,"Rs 1,050.00"
Daily Milk Strawberry 180ml,Rs 130.00
Kist Nectar Lemon & Mint Pet Bottle 1L,Rs 412.00 / Unit
Red Bull Energy Drink Sugar Free 250Ml,Rs 750.00
Island Plain Coffee Pouch 100g,Rs 380.00
Mountain Dew Pet Bottle 1.5L,Rs 400.00
Dilmah Tea Kahata Strong 200G X 2,"Rs 1,225.00"
Soul Coffee House Blend Coffee Pouch 100G,Rs 980.00
Bogawantalawa Tea Bopf Golden Valley Legend 400G,"Rs 1,317.00 / Unit"
Keells Tea Bopf Pouch 100g,Rs 300.00
Keells Tea Bopf Pouch 200g,Rs 585.00
Highland Full Cream Uht Milk Pkt 450ml,Rs 200.00
Md Cordial Nelli Glass Bottle 750Ml,"Rs 1,000.00"
Milo Malted Food Drink Packet 400g,Rs 890.00
K Shong Agg Cof 3 In 1 Capp Pou 16.3G*4S,Rs 920.00
Anchor Fcmp 400G + 200G W/Free Canister,"Rs 1,680.00"
Kist Juice Orange Tetra 200ml,Rs 300.00
Kist Juice Grape Juice Tetra 200Ml,Rs 255.00 / Unit
Eh Drinking Water Pet 5L,Rs 350.00
Kist Juice Apple Tetra 200ml,Rs 200.00
Dilmah Tea Resplendent Island Box 2G*40S,"Rs 2,130.00"
Spinner Caffeinated Drink Watermelon Can 250Ml,Rs 350.00
Kotmale Flav Milk Chocolate Tetra 180ml,Rs 130.00
Island Mint Coffee Pouch 100g,Rs 700.00
K Shong Agg Cof 3 In 1 Mocha Pou 17G*10S,"Rs 1,465.00"
Lipton Tea Green Lemon & Honey 1.5G 20S,Rs 382.00 / Unit
Spinner Caffeinated Drink Sugar Free Can 250Ml,Rs 287.00 / Unit
Anchor Hot Chocolate Regular Packet 400g,"Rs 1,250.00"
Puredale Non-Fat Milk Powder Packet 400G,"Rs 1,000.00"
Kist Nectar Apple Pet Bottle 500Ml,Rs 300.00
Lipton Tea Yellow Label Bag 2G*20S,Rs 293.00 / Unit
Lipton Tea Yellow Label Bag Box 2G*50S,Rs 705.00 / Unit
Maliban Milk Powder Packet 200G,Rs 550.00
Lipton Tea Yellow Label Box 380g,"Rs 1,500.00"
Sozo Juice Blackcurrant And Hibiscus Glass Bottle 1L,"Rs 1,390.00"
Eh Tonic Can 250Ml 6S,Rs 880.00
Nescafe Classic Coffee Jar 50g,"Rs 1,100.00"
Milo Malted Food Drink Chocolate Packet 200G,Rs 560.00
Nescafe Gold Coffee Jar 95g,"Rs 4,200.00"
Elephant House Necto Pet Bottle 500ml,Rs 200.00
Elephant House Iced Tea Twistee Apple Tetra 200ml,Rs 130.00
Fontana Juice Pomegranate Tetra 1L,"Rs 1,580.00"
Md Cordial Mixed Fruit Glass Bottle 750Ml,"Rs 1,100.00"
Md Cordial Orange Glass Bottle 750Ml,"Rs 1,500.00"
Md Sherbet Syrup Glass Bottle 750Ml,"Rs 1,000.00"
Md Nectar Divul Kiri Pet Bottle 1L,Rs 550.00
Kist Juice Orange Tetra 1L,"Rs 1,275.00 / Unit"
Md Mango Delight Glass Bottle 340Ml,Rs 730.00
Md Delight Mixed Fruit Glass Bottle 340Ml,Rs 730.00
Zesta Tea Bopf Pouch 95g,Rs 360.00
Sunquick Concentrate Mango Glass Bottle 300Ml,Rs 680.00
Island Arabica Coffee Jar 250g,"Rs 1,690.00"
Island Ginger Coffee Pouch 100g,Rs 450.00
Sunquick Squash Concentrate Blackcurrant Jumbo Glass Bottle 700Ml,"Rs 1,600.00"
Sunquick Squash Concentrate Orange Glass Bottle 300Ml,Rs 660.00
Sunquick Concentrate Mandarin Glass Bottle 300Ml,Rs 660.00
Keells Tea Bopf Pouch 400g,"Rs 1,200.00"
Keells Tea Bopf Bag Box 2G*25S,Rs 294.00
Keells Tea Bopf Bag Box 2G*50S,Rs 562.00
Enfamama A+ Milk Powder Vanilla Tin 400g,"Rs 3,420.00 / Unit"
Elephant House Cream Soda Pet Bottle 500ml,Rs 200.00
Kist Nectar Orange And Mango Pet Bottle 1L,Rs 550.00
Dilmah Tea Premium Bag Box 2G*25S,Rs 405.00
Daily Milk Banana 180ml,Rs 130.00
Daily Flavored Milk Uht Vanilla Milk Tetra 180Ml,Rs 130.00
Island Arabica Coffee For Filter Jar 250g,"Rs 1,690.00"
Md Nectar Mango Pet Bottle 1L,Rs 550.00
7 Up Pet Bottle 400ml,Rs 180.00
Ambewela Flavoured Milk Uht Vanilla Tetra 1L,Rs 550.00
Yeti Isotonic Pomegranate Pet Bottle 500ml,Rs 350.00
Yeti Isotonic Green Mango Pet Bottle 500ml,Rs 350.00
Md Cordial Mango Glass Bottle 400Ml,Rs 650.00
Md Cordial Mixed Fruit Glass Bottle 400Ml,Rs 552.00 / Unit
Island Plain Coffee Pouch 200g,Rs 730.00
Daily Activ Malt And Chocolate Tetra 180Ml,Rs 130.00
Elephant House Orange Crush Pet Bottle 1.5L,Rs 400.00
Richlife Flavoured Milk Vanilla Tetra 180Ml,Rs 119.00 / Unit
Dilmah Tea Flavoured Ginger Honey Bag Box 1.5G*20S,Rs 500.00
Md Nectar Mixed Fruit Pet Bottle 1L,Rs 550.00
Fontana Juice Cranberry Tetra 1L,"Rs 1,501.00 / Unit"
Fontana Juice Grape Tetra 1L,"Rs 1,720.00"
Dilmah Tea Flavoured Ginger Bag Box 1.5G*20S,Rs 475.00
Motha Milk Shake Chocolate Mix Packet 215G,Rs 280.00
Kist Juice Apple Tetra 1L,"Rs 1,100.00"
Kist Nectar Apple Pet Bottle 1L,Rs 550.00
Dilmah Tea Earl Grey Box 125g,"Rs 1,650.00"
Smak Nectar Ambarella Pet Bottle 500Ml,Rs 320.00
Keells Tea Green Bag Box 1.5G*20S,Rs 280.00
Keells Tea Flav Ginger Bag Box 30G*20S,Rs 425.00
Coca Cola Pet Bottle 2L,Rs 480.00
Kist Nectar Mixed Fruit Pet Bottle 1L,Rs 550.00
Kist Nectar Orange 1L,Rs 550.00
Pure Harvest Organic Milk Soy Tetra 1L,"Rs 1,995.00"
Colman's Flavoured Drink Mango Box 220g,Rs 460.00
Island Spiced Coffee Pouch 50g,Rs 380.00
Nootz Coconut Smoothie Lactose Free Pineapple Tetra 180Ml,Rs 346.00 / Unit
Nootz Coconut Smoothie Mango Tet 180ml,Rs 346.00 / Unit
Bogawantalawa Tea Bopf Kotiyagala Tea 500G,"Rs 1,975.00"
Sun Crush Bitter Lemon Can 250ml,Rs 150.00
Yeti Beast Caffeinated Drink Can 250ml,Rs 500.00
Soul Coffee Indulgence Coffee Pouch 100g,Rs 980.00
Fadna Tea Shape-Up Bag 2G*15S,Rs 975.00
Viva Malted Food Drink Packet 175g,Rs 360.00
Sun Crush Sparkling Mangaa Fizz 250Ml,Rs 150.00
7 Up Pet Bottle 1L,Rs 300.00
Pepsi Pet Bottle 1L,Rs 300.00
Md Sherbet Syrup Glass Bottle 400Ml,Rs 600.00
Ratthi Kirithe Milk Powder 3 In 1 Packet 200G,Rs 440.00
Diamond Full Cream Milk Powder Pouch 400G,"Rs 1,050.00"
Md Nectar Mixed Fruit Pet Bottle 500Ml,Rs 300.00
Zara Milk Tea Mix Cardomom 3 In 1 Packet 200g,Rs 535.00
Steuarst James Coffee Pouch 100G,Rs 315.00 / Unit
Heladiv Peach Iced Tea Syrup 750ml,"Rs 2,000.00"
Heladiv Lemon Iced Tea Syrup 750ml,"Rs 1,600.00 / Unit"
Ahmad Tea Flavoured Chai Spice Box 100G,Rs 790.00
Puredale Blend Milk Powder 2 In 1 Packet 400G,Rs 800.00
Anchor Full Cream Milk Powder Pouch 200g,Rs 580.00
Viva Malted Food Drink Pou 600g,"Rs 1,080.00"
Island Vanilla Coffee Pouch 50g,Rs 230.00
Yeti Sparkling Collagen Can 250ml,Rs 400.00
Motha Faluda Rose Packet 100G,Rs 160.00
Kist Nectar Wood Apple Pet Bottle 500Ml,Rs 300.00
Sprite Pet Bottle 1050Ml,Rs 300.00
Soopervegan Soy Milk Powder Mango Packet 160G,"Rs 1,490.00"
Fontana Juice Guava Tetra 1L,"Rs 1,450.00"
Elephant House Iced Tea Twistee Apple Tetra 1L,Rs 450.00 / Unit
Milo Malted Food Drink Choco Pkt 600g,"Rs 1,200.00"
Harischandra Plain Coffee Pouch 200g,Rs 750.00
Sunquick Squash Concentrate Passion Fruit Jumbo Glass Bottle 700Ml,"Rs 1,410.00"
Island Vanilla Coffee Pouch 100g,Rs 450.00
Diabetasol Nutrient Powder Vanilla Tin 180G,"Rs 3,820.00"
Kinley Soda Pet Bottle 1.5L,Rs 250.00
Sozo Juice Passion Narang Glass Bott 1L,"Rs 1,990.00"
Kotmale Oats Milk Tetra 180ml,Rs 130.00
Smak Nectar Mixed Fruit Pet Bottle 500Ml,Rs 320.00
Smak Nectar Mango Pet Bottle 500Ml,Rs 320.00
Keells Soy Milk Powder Vanilla Packet 200G,"Rs 1,610.00"
Sustagen Nutritional Supplement Powder Junior Vanilla Tin 400G,"Rs 2,750.00"
Sustagen Nut Supp Powd Jun Choc Tin 400g,"Rs 2,750.00"
Soul Coffee Iced Coffee Hazelnut Glass Bottle 200Ml,Rs 580.00
Akbar Gold Coffee Jar 100g,"Rs 2,890.00 / Unit"
Ahmad Tea Bopf Premium Loose Pouch 400g,"Rs 1,340.00"
Sozo Iced Tea Peach And Mango Glass Bottle 1L,"Rs 1,181.00 / Unit"
Sozo Juice Lime Crush Glass Bottle 1L,"Rs 1,351.00 / Unit"
Sozo Juice Ginger Lime Tonic Glass Bottle 1L,"Rs 1,351.00 / Unit"
Elephant House Ginger Beer Pet Bottle 1.5L,Rs 400.00
Zesta Tea Bopf Pouch 190g,Rs 650.00
Viva Malted Food Drink Packet 400g,Rs 730.00
Dilmah Tea Fun Teas Bag 2G*80S,"Rs 2,820.00"
Dilmah Tea Green Pure Ceylon Bag Box 75g,"Rs 1,150.00"
Mirinda Orange Pet Bottle 1.5L,Rs 400.00
Pelwatte Full Cream Milk Powder Pou 1kg,"Rs 2,600.00"
Sunquick Concentrate Guava And Strawberry Glass Bottle 300Ml,Rs 740.00
Dilmah Tea Premium Bag Box 2G*50S,Rs 780.00
Richlife Full Cream Fresh Milk Uht Tetra 180Ml,Rs 119.00 / Unit
Richlife Flavoured Milk Chocolate Tetra 180Ml,Rs 119.00 / Unit
Nescafe Kiri Kopi 3 In 1 Coffee Pouch 18G*10S,Rs 700.00
Daily Flavored Milk Uht Faluda Milk Tetra 180Ml,Rs 117.00 / Unit
Bogawantalawa Tea Kahata Classic 400G,"Rs 1,480.00"
Elephant House Dry Ginger Ale Pet Bottle 500ml,Rs 200.00
Dilmah Tea Earl Grey Bag Box 2G*50S,Rs 975.00
Elephant House Orange Crush Pet Bottle 500ml,Rs 200.00
Kotmale Full Cream Milk Vanilla Tetra 1L,Rs 550.00
Sangsu Tea Green Fat Burner Bag 2G*30S,"Rs 1,099.00"
Kotmale Flavoured Milk Chox Food Drink Tetra 180Ml,Rs 130.00
Fadna Tea Iramusu Cooling Bag 2G*10S,Rs 600.00
Maliban Non-Fat Milk Powder Packet 400G,"Rs 1,150.00"
Nestomalt Malted Food Drink Packet 175G,Rs 390.00
Newdale Flavored Milk Uht Chocolate Tetra 180Ml,Rs 130.00
Dilmah Tea Ceylon Supreme Bag 2G*50S,Rs 950.00
My Juicee Nectar Apple Tetra 200ml,Rs 108.00 / Unit
Khao Shong Coffee Red Jar 50G,"Rs 1,025.00"
Olu Tropical Sparkling Glass Water 330ml,Rs 325.00
Pure Harvest Org Milk Oat Unsweet Tet 1L,"Rs 1,995.00"
Nestle Coffeemate 400g,"Rs 1,900.00"
Yeti Hydrate Drink Citrus Glass Bottle 350ml,Rs 450.00
Yeti Vitamin Drink Orange Glass Bottle 350ml,Rs 450.00
Richlife Ice Coffee Tetra 1L,Rs 620.00
Richlife Flavoured Milk Strawberry Tetra 180Ml,Rs 119.00 / Unit
Elephant House Fit O Nectar Mixed Fruit Tetra 1L,Rs 510.00 / Unit
Eh Fit O Nectar Mixed Fruit Tetra 200ml,Rs 130.00
Fanta Orange Pet Bottle 1.05L,Rs 300.00
Sunquick Concentrate Blackcurrant Glass Bottle 300Ml,Rs 840.00
Lipton Tea Green Citrus Bag Box 1.5G*20S,Rs 450.00
Enfamama A+ Milk Powder Chocolate Tin 400g,"Rs 3,420.00 / Unit"
Fanta Cream Soda Pet Bottle 1.05L,Rs 300.00
Nescafe Gold Decaff Coffee Jar 100g,"Rs 4,200.00"
Fadna Tea Ranawara Bag 2G*10S,Rs 570.00
Steuarts James Coffee Pouch 50g,Rs 210.00
Kist Nectar Mango Pet Bottle 1L,Rs 550.00
Kist Nectar Wood Apple Pet Bottle 1L,Rs 550.00
Fadna Tea Diabe Bag 2G*20S,Rs 750.00
Fadna Tea Herbal Belimal Bag 2G*10S,Rs 570.00
Anlene High Calcium Low Fat Milk Powder Packet 200g,Rs 690.00
My Juicee Nectar Apple Tetra 1L,Rs 550.00
My Juicee Nectar Mango Tetra 1L,Rs 550.00
My Juicee Nectar Mixed Fruit Tetra 1L,Rs 495.00 / Unit
Elephant House Soda Pet Bottle 500ml,Rs 120.00
Nescafe Classic Coffee Box 50g,Rs 940.00
Zesta Tea Bopf Tea Bag Pouch 1.8G*100S,"Rs 1,300.00"
Dilmah Tea Green Ceylon Bag Box 1.5G*20S,Rs 450.00
Sunquick Squash Concentrate Orange Jumbo Glass Bottle 700Ml,"Rs 1,310.00"
Sunquick Squash Concentrate Mandarin Jumbo Glass Bottle 700Ml,"Rs 1,310.00"
Elephant House Cream Soda Pet Bottle 1.5L,Rs 400.00
Fanta Portello Pet Bottle 1.5L,Rs 400.00
Zesta Tea Bopf Tea Bag Pouch 1.8G*25S,Rs 375.00
Smak Nectar Mango Pet Bottle 1L,Rs 570.00
Smak Nectar Wood Apple Pet Bottle 1L,Rs 570.00
Red Bull Energy Drink 250Ml 4 Set Pack,"Rs 2,880.00"
Fanta Cream Soda Pet Bottle 1.5L,Rs 400.00
Sethum Kasa Kasa Packet 200G,Rs 660.00
Pepsi Pet Bottle 1.5L,Rs 300.00 / Unit
7 Up Pet Bottle 1.5L,Rs 300.00 / Unit
Dilmah Tea Flavoured Lemon Bag Box 1.5G*20S,Rs 430.00
Dilmah Tea Flavoured Strawberry Bag Box 1.5G*20S,Rs 450.00
Dilmah Tea Green Tea + Ginger Bag Box 2G*20S,Rs 470.00
Dilmah Tea English Afternoon Bag Box 2G*50S,"Rs 1,095.00"
Maliban Full Cream Milk Powder Pou 1kg,"Rs 2,750.00"
Elephant House Orange Barley Pet Bottle 1.5L,Rs 400.00
Dilmah Tea Bopf Premium Loose Pouch 200g,Rs 715.00
Dilmah Tea Kahata Strong 100g,Rs 330.00
Soopervegan Soy Malt Chocolate Packet 200G,"Rs 1,495.00"
Soopervegan Soy Malt Packet 200G,"Rs 1,490.00"
Md Nectar Mixed Fruit Pet Bottle 200Ml,Rs 140.00
Watawala Tea Kahata Pouch 100g,Rs 295.00
Dilmah Tea Green Moroccon Mint Bag Box 2G*20S,Rs 427.00 / Unit
Dilmah Tea Flavoured Cinnamon Bag Box 1.5G*20S,Rs 460.00
Pfanner 100% Juice Apple Tetra 1L,"Rs 1,820.00"
Pfanner 100% Juice Green Apple Tetra 1L,"Rs 1,590.00"
Elephant House Necto Pet Bottle 1L,Rs 300.00
Elephant House Orange Crush Pet Bottle 1L,Rs 300.00
Eh Lemonade Pet 1L,Rs 250.00
Elephant House Fit O Nectar Orange Tetra 1L,Rs 540.00 / Unit
Elephant House Fit O Nectar Mango Tetra 1L,Rs 600.00
Elephant House Fit O Nectar Orange Tetra 200ml,Rs 130.00
Elephant House Fit O Nectar Mango Tetra 200ml,Rs 117.00 / Unit
Nestomalt Malted Food Drink Pouch 600G,"Rs 1,120.00"
Md Nectar Orange Pet Bottle 1L,Rs 467.00 / Unit
Kotmale Flavoured Milk Uht Faluda Tetra 1L,Rs 600.00
Sozo Iced Tea Peach & Mango Glass Bottle 350ml,Rs 680.00
Sozo Iced Tea Forest Berries Glass Bottle 350ml,Rs 680.00
Kik Cola 1L,Rs 200.00
Keells Soy Milk Chocolate Glass Bottle 200Ml,Rs 710.00
Coca Cola Pet Bottle 1.5L,Rs 400.00
Sprite Pet Bottle 1.5L,Rs 400.00
Kotmale Flav Milk Uht Van. Tet 180Ml 6S,Rs 790.00
Eh Lemonade Pet 1.5L,Rs 350.00
Mirinda Orange Pet Bottle 400Ml,Rs 180.00
Fontana Pineapple 100% Natural Juice Tetra 1L,"Rs 1,720.00"
Dilmah Tea Bopf Premium Envelope Bag 2G*100S,"Rs 1,870.00"
Dilmah Tea Green Tea + Jasmine Bag Box 2G*20S,Rs 550.00
Dilmah Tea Green Tea + Cinnamon Bag Box 2G*20S,Rs 470.00
Red Bull Energy Drink 250Ml 2 Set Pack,"Rs 1,450.00"
Keells Soy Milk Glass Bottle 200Ml,Rs 651.00
Sozo Juice Ginger Lemonade Glass Bottle 350ml,Rs 690.00
Sozo Juice Raspberry Hibis G/Bot 350ml,Rs 680.00
Sozo Juice Passion Fruit And Narang Glass Bottle 200Ml,Rs 530.00
Richlife Flavoured Milk Pack Tetra 180Ml 4 Set,Rs 477.00 / Unit
Sunquick Concentrate Fruit Cocktail Glass Bottle 300Ml,Rs 660.00
Sunquick Squash Concentrate Fruit Cocktail Jumbo Glass Bottle 700Ml,"Rs 1,310.00"
Smak Nectar Aloe Vera Pet Bottle 200Ml,Rs 140.00
Dilmah Tea Ceylon Breakfast Tin 225g,"Rs 3,700.00"
Dilmah Tea Story Of Rathnapura Tin 175g,"Rs 2,400.00"
Sunquick Con. Apple G/Bott 300ml,Rs 680.00
Daily Flavoured Milk Uht Iced Coffee Tetra 180ml,Rs 126.00 / Unit
Newlife Tea Herbal Bag 2G*42S,"Rs 1,180.00"
Nescafe Gold Espresso Coffee Jar 95g,"Rs 4,200.00"
Fever Tree Premium Tonic Water Glass Bottle 200ml,Rs 895.00
Sozo Juice Tamarind Juice Glass Bottle 200Ml,Rs 530.00
Yeti Vitamin Drink Multi Fruit Glass Bottle 350ml,Rs 450.00
Yeti De-Stress Vitamin Drink Pomegranate Glass Bottle 350ml,Rs 450.00
Smak Nectar Mango Pet Bottle 200ml,Rs 140.00
Newlife Tea Herbal Box 75g,Rs 944.00
Lavazza Ground Rossa Coffee Pouch 250g,"Rs 4,550.00"
Battler Green Tea Tin Caddy 100g,"Rs 1,710.00 / Unit"
Tealia Tea Ceylon Cinnamon Chai Tin 100g,"Rs 1,980.00 / Unit"
Zesta Tea Herbal Immune Boost Bag Box 2G*20S,"Rs 1,060.00"
Soul Chocolate Drink Tin 200g,"Rs 1,629.00 / Unit"
Soul Coffee Iced Coffee Latte Glass Bottle 200Ml,Rs 580.00
Soul Coffee Iced Coffee Chocolate Glass Bottle 200Ml,Rs 580.00
Sunquick Con. Passion Fruit G/Bott 300ml,Rs 690.00
Smak Nectar Wood Apple Pet Bottle 500Ml,Rs 320.00
Monster Energy Drink Can 355ml,Rs 700.00
Battler Tea Gold Elephant Box 2G*25S,Rs 359.00 / Unit
Battler Tea Black Elephant Box 2G*25S,Rs 359.00 / Unit
Battler Tea Green Elephant Box 2G*25S,Rs 359.00 / Unit
Fadna Tea Herbal Tummy Tea Bag Box 2G*15S,Rs 975.00
Shaktea Caffeinated Energy Drink Can 250Ml,Rs 325.00
Keells Tea Herbal Belimal Bag Box 2G*10S,Rs 513.00
Sun Crush Imperial Club Soda Can 250ml,Rs 120.00
Viscafe Shong Ice Coffee Pouch 360g,"Rs 1,420.00"
Viscafe Shong Hot Chocolate 3 In 1 Pouch 360g,"Rs 1,335.00"
Ratthi Kirithe Milk Powder 3 In 1 Packet 400G,Rs 880.00
Nootz Coconut Smoothie Papaya Tet 180ml,Rs 247.00 / Unit
Soul Instant Coffee Tin 50g,"Rs 1,080.00"
Raala King Coconut Glass Bottle 370ml,Rs 550.00
Dilmah Tea Udawatte Tin 125g,"Rs 2,070.00"
Battler Tea Summer Time Tin Caddy 100g,"Rs 1,890.00 / Unit"
Tealia Tea Organic Earl Grey Bag Box 2G*20S,"Rs 1,080.00 / Unit"
Elephant House Necto Can 250ml,Rs 150.00
